{
  "number": 2720,
  "id": "1ca3e0829d5e9a9891fb3b0afb8af4458d6b5a5b9b31139b786d7a322f8c4b78i0",
  "name": "Degent #2720",
  "tier": "fullblock",
  "lane": "block",
  "contentBytes": 3946670,
  "revealWeightWU": 3969979,
  "revealVsize": 992495,
  "blockWeightLimitWU": 4000000,
  "blockFraction": 0.99249475,
  "feeRate": null,
  "facts": {
    "timestamp": null,
    "height": null,
    "feeSats": null,
    "address": null,
    "contentType": null
  },
  "estimated": true,
  "links": {
    "ordinals": "https://ordinals.com/inscription/1ca3e0829d5e9a9891fb3b0afb8af4458d6b5a5b9b31139b786d7a322f8c4b78i0",
    "ordiscan": "https://ordiscan.com/inscription/1ca3e0829d5e9a9891fb3b0afb8af4458d6b5a5b9b31139b786d7a322f8c4b78i0",
    "magicEden": "https://magiceden.io/ordinals/item-details/1ca3e0829d5e9a9891fb3b0afb8af4458d6b5a5b9b31139b786d7a322f8c4b78i0",
    "xray": "https://block.space/xray/1ca3e0829d5e9a9891fb3b0afb8af4458d6b5a5b9b31139b786d7a322f8c4b78",
    "theater": null
  }
}
