{
  "number": 2651,
  "id": "997e2d19f2c5289b063786a72ea7914b7bb7ab015b1fc0ce145ae4d30bf86f50i0",
  "name": "Degent #2651",
  "tier": "fullblock",
  "lane": "block",
  "contentBytes": 3913540,
  "revealWeightWU": 3936658,
  "revealVsize": 984165,
  "blockWeightLimitWU": 4000000,
  "blockFraction": 0.9841645,
  "feeRate": null,
  "facts": {
    "timestamp": null,
    "height": null,
    "feeSats": null,
    "address": null,
    "contentType": null
  },
  "estimated": true,
  "links": {
    "ordinals": "https://ordinals.com/inscription/997e2d19f2c5289b063786a72ea7914b7bb7ab015b1fc0ce145ae4d30bf86f50i0",
    "ordiscan": "https://ordiscan.com/inscription/997e2d19f2c5289b063786a72ea7914b7bb7ab015b1fc0ce145ae4d30bf86f50i0",
    "magicEden": "https://magiceden.io/ordinals/item-details/997e2d19f2c5289b063786a72ea7914b7bb7ab015b1fc0ce145ae4d30bf86f50i0",
    "xray": "https://block.space/xray/997e2d19f2c5289b063786a72ea7914b7bb7ab015b1fc0ce145ae4d30bf86f50",
    "theater": null
  }
}
